{"edges":[{"from":"l2:.ownmem/MEMORY-general.md","kind":"l2-hook","to":"topic:ci_latency_lock_needs_machine_scaling"},{"from":"l2:.ownmem/MEMORY-general.md","kind":"l2-hook","to":"topic:lockfile_must_pin_canonical_registry"},{"from":"l2:.ownmem/MEMORY-general.md","kind":"l2-hook","to":"topic:npm_publish_requires_2fa_and_ci_provenance"},{"from":"l2:.ownmem/MEMORY-general.md","kind":"l2-hook","to":"topic:offline_e2e_requires_fixture_owned_npm_cache"},{"from":"topic:ci_latency_lock_needs_machine_scaling","kind":"code-test","to":"code:memory-public-benchmark-self-test.mjs"},{"from":"topic:ci_latency_lock_needs_machine_scaling","kind":"code-evidence","to":"code:memory-public-benchmark.mjs"},{"from":"topic:lockfile_must_pin_canonical_registry","kind":"code-evidence","to":"code:package-lock.json"},{"from":"topic:npm_publish_requires_2fa_and_ci_provenance","kind":"code-evidence","to":"code:package.json"},{"from":"topic:offline_e2e_requires_fixture_owned_npm_cache","kind":"code-evidence","to":"code:memory-public-self-test.mjs"},{"from":"topic:offline_e2e_requires_fixture_owned_npm_cache","kind":"code-test","to":"code:memory-public-self-test.mjs"}],"nodes":[{"id":"code:memory-public-benchmark-self-test.mjs","kind":"code","label":"memory-public-benchmark-self-test.mjs"},{"id":"code:memory-public-benchmark.mjs","kind":"code","label":"memory-public-benchmark.mjs"},{"id":"code:memory-public-self-test.mjs","kind":"code","label":"memory-public-self-test.mjs"},{"id":"code:package-lock.json","kind":"code","label":"package-lock.json"},{"id":"code:package.json","kind":"code","label":"package.json"},{"id":"l2:.ownmem/MEMORY-general.md","kind":"l2","label":"MEMORY-general.md"},{"id":"topic:ci_latency_lock_needs_machine_scaling","kind":"topic","label":"ci_latency_lock_needs_machine_scaling"},{"id":"topic:lockfile_must_pin_canonical_registry","kind":"topic","label":"lockfile_must_pin_canonical_registry"},{"id":"topic:npm_publish_requires_2fa_and_ci_provenance","kind":"topic","label":"npm_publish_requires_2fa_and_ci_provenance"},{"id":"topic:offline_e2e_requires_fixture_owned_npm_cache","kind":"topic","label":"offline_e2e_requires_fixture_owned_npm_cache"}],"reverse_dependencies":[{"id":"code:memory-public-benchmark-self-test.mjs","references":[{"from":"topic:ci_latency_lock_needs_machine_scaling","kind":"code-test"}]},{"id":"code:memory-public-benchmark.mjs","references":[{"from":"topic:ci_latency_lock_needs_machine_scaling","kind":"code-evidence"}]},{"id":"code:memory-public-self-test.mjs","references":[{"from":"topic:offline_e2e_requires_fixture_owned_npm_cache","kind":"code-evidence"},{"from":"topic:offline_e2e_requires_fixture_owned_npm_cache","kind":"code-test"}]},{"id":"code:package-lock.json","references":[{"from":"topic:lockfile_must_pin_canonical_registry","kind":"code-evidence"}]},{"id":"code:package.json","references":[{"from":"topic:npm_publish_requires_2fa_and_ci_provenance","kind":"code-evidence"}]},{"id":"topic:ci_latency_lock_needs_machine_scaling","references":[{"from":"l2:.ownmem/MEMORY-general.md","kind":"l2-hook"}]},{"id":"topic:lockfile_must_pin_canonical_registry","references":[{"from":"l2:.ownmem/MEMORY-general.md","kind":"l2-hook"}]},{"id":"topic:npm_publish_requires_2fa_and_ci_provenance","references":[{"from":"l2:.ownmem/MEMORY-general.md","kind":"l2-hook"}]},{"id":"topic:offline_e2e_requires_fixture_owned_npm_cache","references":[{"from":"l2:.ownmem/MEMORY-general.md","kind":"l2-hook"}]}],"schema":"ownmem-index.graph/v2"}
